{
  "schema_version": "reconstruction_patch_v1",
  "patch_id": "rpatch_reqdemo_001",
  "request_id": "req_demo",
  "plan_id": "rp_reqdemo_psdreqde",
  "decision_id": "psd_req_demo_1",
  "operation_id": "op_rp_reqdemo_psdreqde_001",
  "target_step_id": "step_002",
  "patch_type": "revision_placeholder",
  "patch_status": "proposed",
  "execution_mode": "patch_proposal_only",
  "original_content_hash": "47bce22da6a80c25282497059e5a89ffb7e625f38ba454c7f42e1f0682f5b7bb",
  "original_content_preserved": true,
  "original_content_mutated": false,
  "content_rewrite_applied": false,
  "proposed_patch": {
    "proposal_kind": "deterministic_placeholder",
    "summary": "Controlled reconstruction patch proposal for step_002.",
    "suggested_action": "revise_later",
    "placeholder_text": "[RECONSTRUCTION_PROPOSAL_ONLY] Step step_002 is marked for future controlled revision by plan rp_reqdemo_psdreqde. Original content is preserved. No rewrite has been applied."
  },
  "rationale": "Po_self emitted a reconstruct decision and ReconstructionPlan requested revise_step for this target. PR-007 only creates a deterministic patch proposal.",
  "trace_refs": [
    "evt_semantic_profile_001",
    "evt_po_self_decision_001",
    "evt_po_self_reconstruction_planned_001"
  ],
  "created_at": "2026-07-02T02:35:29Z",
  "viewer_feedback_refs": [],
  "notes": []
}
